{"$schema":"https://json-schema.org/draft/2020-12/schema","$id":"https://hoy.local/contracts/lifestyle-record-v1.schema.json","title":"HOY Lifestyle Record v1","type":"object","required":["id","slug","name","entityType","locality","category","environment","status","suppressed","nowFit","priority","familyData","lastVerified","contact","commercial","accessibility","trust","geo"],"properties":{"id":{"type":"integer","minimum":1},"slug":{"type":"string","pattern":"^[a-z0-9-]+$"},"name":{"type":"string","minLength":1},"entityType":{"type":["string","null"]},"locality":{"type":["string","null"]},"category":{"type":["string","null"]},"environment":{"type":["string","null"]},"status":{"type":"string"},"suppressed":{"type":"boolean"},"nowFit":{"enum":["High","Medium","Low",null]},"priority":{"enum":["P1","P2","P3",null]},"familyData":{"type":["string","null"]},"lastVerified":{"type":["string","null"]},"contact":{"type":"object"},"commercial":{"type":"object"},"accessibility":{"type":"object"},"trust":{"type":"object"},"geo":{"type":"object"}},"additionalProperties":true}
