[{"id":1,"slug":"1-bonds-jet-ski","name":"Bonds Jet Ski","entityType":"Provider","locality":"La Manga","category":"Jet ski & motor water sports","environment":"Outdoor / water","status":"Active","suppressed":false,"nowFit":"High","priority":"P1","familyData":"Possible / verify","lastVerified":"2026-08-18","contact":{"phone":"+34 682 248 676","bookingUrl":"https://bondsjet.com/en"},"commercial":{"priceText":null,"ageRulesText":null},"accessibility":{"status":"Not publicly verified","mobilityEvidence":null,"confidence":"Low"},"trust":{"evidenceGrade":"A","sourceUrls":["https://bondsjet.com/en"],"ownerConfirmed":false,"hoyVerified":false,"liveToday":false},"geo":{"mapUrl":null,"lat":null,"lng":null}},{"id":2,"slug":"2-rent-boats-alicante-la-manga-base","name":"Rent Boats Alicante – La Manga base","entityType":"Provider","locality":"La Manga","category":"Boat rental & charter","environment":"Outdoor / water","status":"Active","suppressed":false,"nowFit":"High","priority":"P1","familyData":"Yes","lastVerified":"2026-08-18","contact":{"phone":"+34 678 980 335","bookingUrl":null},"commercial":{"priceText":null,"ageRulesText":null},"accessibility":{"status":"Not publicly verified","mobilityEvidence":null,"confidence":"Low"},"trust":{"evidenceGrade":"B","sourceUrls":["https://www.google.com/maps/search/?api=1&query=Rent%20Boats%20Alicante%20La%20Manga"],"ownerConfirmed":false,"hoyVerified":false,"liveToday":false},"geo":{"mapUrl":null,"lat":null,"lng":null}},{"id":3,"slug":"3-ksurf-la-manga","name":"KSURF LA MANGA","entityType":"Provider","locality":"Playa Honda","category":"Water sports school","environment":"Outdoor / water","status":"Active","suppressed":false,"nowFit":"High","priority":"P1","familyData":"Yes","lastVerified":"2026-08-18","contact":{"phone":"+34 633 528 789","bookingUrl":"https://ksurflamanga.com/"},"commercial":{"priceText":null,"ageRulesText":null},"accessibility":{"status":"Not publicly verified","mobilityEvidence":null,"confidence":"Low"},"trust":{"evidenceGrade":"A","sourceUrls":["https://ksurflamanga.com/"],"ownerConfirmed":false,"hoyVerified":false,"liveToday":false},"geo":{"mapUrl":null,"lat":null,"lng":null}},{"id":4,"slug":"4-sailing-school-sandrina","name":"Sailing School Sandrina","entityType":"Provider","locality":"La Manga","category":"Water sports school","environment":"Outdoor / water","status":"Active","suppressed":false,"nowFit":"High","priority":"P1","familyData":"Yes","lastVerified":"2026-08-18","contact":{"phone":"+34 653 273 563","bookingUrl":"https://escuelasandrina.com/"},"commercial":{"priceText":null,"ageRulesText":null},"accessibility":{"status":"Not publicly verified","mobilityEvidence":null,"confidence":"Low"},"trust":{"evidenceGrade":"B","sourceUrls":["https://escuelasandrina.com/"],"ownerConfirmed":false,"hoyVerified":false,"liveToday":false},"geo":{"mapUrl":null,"lat":null,"lng":null}},{"id":5,"slug":"5-tatowind-escuela-de-vela","name":"Tatowind Escuela de Vela","entityType":"Provider","locality":"La Manga","category":"Water sports school","environment":"Outdoor / water","status":"Active","suppressed":false,"nowFit":"High","priority":"P1","familyData":"Yes","lastVerified":"2026-08-18","contact":{"phone":"+34 699 220 683","bookingUrl":"https://tatowind.com/"},"commercial":{"priceText":null,"ageRulesText":null},"accessibility":{"status":"Not publicly verified","mobilityEvidence":null,"confidence":"Low"},"trust":{"evidenceGrade":"A","sourceUrls":["https://tatowind.com/"],"ownerConfirmed":false,"hoyVerified":false,"liveToday":false},"geo":{"mapUrl":null,"lat":null,"lng":null}},{"id":6,"slug":"6-actividades-nauticas-dacar","name":"Actividades Náuticas Dacar","entityType":"Provider","locality":"La Manga / Cabo de Palos","category":"Water sports school","environment":"Outdoor / water","status":"Active","suppressed":false,"nowFit":"High","priority":"P1","familyData":"Yes","lastVerified":"2026-08-18","contact":{"phone":"+34 625 924 019","bookingUrl":"https://actividadesnauticasdacar.com/cursos/"},"commercial":{"priceText":null,"ageRulesText":null},"accessibility":{"status":"Not publicly verified","mobilityEvidence":null,"confidence":"Low"},"trust":{"evidenceGrade":"A","sourceUrls":["https://actividadesnauticasdacar.com/cursos/"],"ownerConfirmed":false,"hoyVerified":false,"liveToday":false},"geo":{"mapUrl":null,"lat":null,"lng":null}},{"id":7,"slug":"7-mangasurf","name":"Mangasurf","entityType":"Provider","locality":"La Manga","category":"Water sports school","environment":"Outdoor / water","status":"Active","suppressed":false,"nowFit":"High","priority":"P1","familyData":"Yes","lastVerified":"2026-08-18","contact":{"phone":"+34 968 145 331","bookingUrl":"https://www.mangasurf.com/www-mangasurf-com/"},"commercial":{"priceText":null,"ageRulesText":null},"accessibility":{"status":"Not publicly verified","mobilityEvidence":null,"confidence":"Low"},"trust":{"evidenceGrade":"A","sourceUrls":["https://www.mangasurf.com/www-mangasurf-com/"],"ownerConfirmed":false,"hoyVerified":false,"liveToday":false},"geo":{"mapUrl":null,"lat":null,"lng":null}},{"id":8,"slug":"8-cavanna-wind","name":"Cavanna Wind","entityType":"Provider","locality":"La Manga","category":"Water sports school","environment":"Outdoor / water","status":"Active","suppressed":false,"nowFit":"High","priority":"P2","familyData":"Yes","lastVerified":"2026-08-18","contact":{"phone":null,"bookingUrl":null},"commercial":{"priceText":null,"ageRulesText":null},"accessibility":{"status":"Not publicly verified","mobilityEvidence":null,"confidence":"Low"},"trust":{"evidenceGrade":"A","sourceUrls":[],"ownerConfirmed":false,"hoyVerified":false,"liveToday":false},"geo":{"mapUrl":null,"lat":null,"lng":null}},{"id":9,"slug":"9-escuela-de-vela-dos-mares-wind","name":"Escuela de Vela Dos Mares Wind","entityType":"Provider","locality":"La Manga","category":"Water sports school","environment":"Outdoor / water","status":"Active","suppressed":false,"nowFit":"High","priority":"P2","familyData":"Yes","lastVerified":"2026-08-18","contact":{"phone":null,"bookingUrl":null},"commercial":{"priceText":null,"ageRulesText":null},"accessibility":{"status":"Not publicly verified","mobilityEvidence":null,"confidence":"Low"},"trust":{"evidenceGrade":"B","sourceUrls":[],"ownerConfirmed":false,"hoyVerified":false,"liveToday":false},"geo":{"mapUrl":null,"lat":null,"lng":null}},{"id":10,"slug":"10-escuela-de-vela-pedruchillo-el-galan","name":"Escuela de Vela Pedruchillo / El Galán","entityType":"Provider","locality":"La Manga","category":"Water sports school","environment":"Outdoor / water","status":"Active","suppressed":false,"nowFit":"High","priority":"P1","familyData":"Yes","lastVerified":"2026-08-18","contact":{"phone":"+34 670 777 771","bookingUrl":"https://www.velagalan.com/index.php?seccion=escuela-vela"},"commercial":{"priceText":null,"ageRulesText":null},"accessibility":{"status":"Not publicly verified","mobilityEvidence":null,"confidence":"Low"},"trust":{"evidenceGrade":"B","sourceUrls":["https://www.velagalan.com/index.php?seccion=escuela-vela"],"ownerConfirmed":false,"hoyVerified":false,"liveToday":false},"geo":{"mapUrl":null,"lat":null,"lng":null}}]