[{"id":91,"slug":"91-socaire-sailing-school","name":"Socaire Sailing School","entityType":"Provider","locality":"Santiago de la Ribera","category":"Water sports school","environment":"Outdoor / water","status":"Active","suppressed":false,"nowFit":"Medium","priority":"P3","familyData":"Yes","lastVerified":"2026-08-18","contact":{"phone":null,"bookingUrl":null},"commercial":{"priceText":null,"ageRulesText":null},"accessibility":{"status":"Not publicly verified","mobilityEvidence":null,"confidence":"Low"},"trust":{"evidenceGrade":"A","sourceUrls":[],"ownerConfirmed":false,"hoyVerified":false,"liveToday":false},"geo":{"mapUrl":null,"lat":null,"lng":null}},{"id":92,"slug":"92-real-club-de-regatas-santiago-de-la-ribera","name":"Real Club de Regatas Santiago de la Ribera","entityType":"Provider/Place","locality":"Santiago de la Ribera","category":"Nautical club","environment":"Outdoor / water","status":"Active","suppressed":false,"nowFit":"Medium","priority":"P3","familyData":"Yes","lastVerified":"2026-08-18","contact":{"phone":null,"bookingUrl":null},"commercial":{"priceText":null,"ageRulesText":null},"accessibility":{"status":"Not publicly verified","mobilityEvidence":null,"confidence":"Medium"},"trust":{"evidenceGrade":"A","sourceUrls":[],"ownerConfirmed":false,"hoyVerified":false,"liveToday":false},"geo":{"mapUrl":null,"lat":null,"lng":null}},{"id":93,"slug":"93-trueno-boats","name":"TRUENO BOATS","entityType":"Provider","locality":"Santiago de la Ribera","category":"Boat rental & charter","environment":"Outdoor / water","status":"Active","suppressed":false,"nowFit":"Medium","priority":"P3","familyData":"Yes","lastVerified":"2026-08-18","contact":{"phone":null,"bookingUrl":null},"commercial":{"priceText":null,"ageRulesText":null},"accessibility":{"status":"Not publicly verified","mobilityEvidence":null,"confidence":"Low"},"trust":{"evidenceGrade":"A","sourceUrls":[],"ownerConfirmed":false,"hoyVerified":false,"liveToday":false},"geo":{"mapUrl":null,"lat":null,"lng":null}},{"id":94,"slug":"94-teatro-romano-de-cartagena","name":"Teatro Romano de Cartagena","entityType":"Place","locality":"Cartagena","category":"Culture & sightseeing","environment":"Indoor / outdoor","status":"Active","suppressed":false,"nowFit":"High","priority":"P2","familyData":"Yes","lastVerified":"2026-08-18","contact":{"phone":null,"bookingUrl":null},"commercial":{"priceText":null,"ageRulesText":null},"accessibility":{"status":"Verified highly accessible","mobilityEvidence":null,"confidence":"High"},"trust":{"evidenceGrade":"A","sourceUrls":[],"ownerConfirmed":false,"hoyVerified":true,"liveToday":false},"geo":{"mapUrl":null,"lat":null,"lng":null}},{"id":95,"slug":"95-barco-turistico-cartagena","name":"Barco Turístico Cartagena","entityType":"Provider","locality":"Cartagena","category":"Boat excursions","environment":"Outdoor / water","status":"Active","suppressed":false,"nowFit":"High","priority":"P2","familyData":"Yes","lastVerified":"2026-08-18","contact":{"phone":null,"bookingUrl":null},"commercial":{"priceText":null,"ageRulesText":null},"accessibility":{"status":"Verified accessible","mobilityEvidence":null,"confidence":"High"},"trust":{"evidenceGrade":"A","sourceUrls":[],"ownerConfirmed":false,"hoyVerified":true,"liveToday":false},"geo":{"mapUrl":null,"lat":null,"lng":null}},{"id":96,"slug":"96-ascensor-panoramico-cartagena","name":"Ascensor Panorámico Cartagena","entityType":"Place","locality":"Cartagena","category":"Culture & sightseeing","environment":"Indoor / sightseeing","status":"Active","suppressed":false,"nowFit":"Medium","priority":"P3","familyData":"Yes","lastVerified":"2026-08-18","contact":{"phone":null,"bookingUrl":null},"commercial":{"priceText":null,"ageRulesText":null},"accessibility":{"status":"Official accessibility upgrades documented / completion recheck","mobilityEvidence":null,"confidence":"High"},"trust":{"evidenceGrade":"A","sourceUrls":[],"ownerConfirmed":false,"hoyVerified":false,"liveToday":false},"geo":{"mapUrl":null,"lat":null,"lng":null}},{"id":97,"slug":"97-mysterium-escape-room-cartagena","name":"Mysterium Escape Room Cartagena","entityType":"Provider","locality":"Cartagena","category":"Indoor entertainment","environment":"Indoor","status":"Active","suppressed":false,"nowFit":"High","priority":"P3","familyData":"Yes","lastVerified":"2026-08-18","contact":{"phone":null,"bookingUrl":null},"commercial":{"priceText":null,"ageRulesText":null},"accessibility":{"status":"Not publicly verified","mobilityEvidence":null,"confidence":"Low"},"trust":{"evidenceGrade":"C","sourceUrls":[],"ownerConfirmed":false,"hoyVerified":false,"liveToday":false},"geo":{"mapUrl":null,"lat":null,"lng":null}},{"id":98,"slug":"98-cartagena-karting-club","name":"Cartagena Karting Club","entityType":"Provider","locality":"Cartagena area","category":"Family & amusement","environment":"Outdoor","status":"Active","suppressed":false,"nowFit":"Medium","priority":"P3","familyData":"Yes","lastVerified":"2026-08-18","contact":{"phone":null,"bookingUrl":null},"commercial":{"priceText":null,"ageRulesText":null},"accessibility":{"status":"Not publicly verified","mobilityEvidence":null,"confidence":"Low"},"trust":{"evidenceGrade":"B","sourceUrls":[],"ownerConfirmed":false,"hoyVerified":false,"liveToday":false},"geo":{"mapUrl":null,"lat":null,"lng":null}},{"id":99,"slug":"99-quadadventures-murcia","name":"Quadadventures-Murcia","entityType":"Provider","locality":"Fuente Álamo","category":"Adventure / motor","environment":"Outdoor / land","status":"Active","suppressed":false,"nowFit":"Medium","priority":"P3","familyData":"Possible / verify","lastVerified":"2026-08-18","contact":{"phone":null,"bookingUrl":null},"commercial":{"priceText":null,"ageRulesText":null},"accessibility":{"status":"Not publicly verified","mobilityEvidence":null,"confidence":"Low"},"trust":{"evidenceGrade":"A","sourceUrls":[],"ownerConfirmed":false,"hoyVerified":false,"liveToday":false},"geo":{"mapUrl":null,"lat":null,"lng":null}},{"id":100,"slug":"100-la-manga-activa","name":"La Manga Activa","entityType":"Provider","locality":"La Manga / Cabo de Palos","category":"Outdoor experiences / guided activities","environment":"Outdoor / water & land","status":"Active","suppressed":false,"nowFit":"High","priority":"P1","familyData":"Possible / verify","lastVerified":"2026-08-18","contact":{"phone":null,"bookingUrl":"https://lamangaactiva.com/"},"commercial":{"priceText":null,"ageRulesText":null},"accessibility":{"status":"Not publicly verified","mobilityEvidence":null,"confidence":"High"},"trust":{"evidenceGrade":"A","sourceUrls":["https://lamangaactiva.com/swim-cabopalero/"],"ownerConfirmed":false,"hoyVerified":false,"liveToday":false},"geo":{"mapUrl":null,"lat":null,"lng":null}}]