[{"id":81,"slug":"81-pirata-surf-mar-de-cristal","name":"Pirata Surf Mar de Cristal","entityType":"Provider","locality":"Mar de Cristal","category":"Water sports school","environment":"Outdoor / water","status":"Active","suppressed":false,"nowFit":"Medium","priority":"P2","familyData":"Yes","lastVerified":"2026-08-18","contact":{"phone":null,"bookingUrl":null},"commercial":{"priceText":null,"ageRulesText":null},"accessibility":{"status":"Not publicly verified","mobilityEvidence":null,"confidence":"Low"},"trust":{"evidenceGrade":"C","sourceUrls":[],"ownerConfirmed":false,"hoyVerified":false,"liveToday":false},"geo":{"mapUrl":null,"lat":null,"lng":null}},{"id":82,"slug":"82-jet-ski-rental-mar-de-cristal","name":"Jet Ski Rental Mar de Cristal","entityType":"Provider","locality":"Mar de Cristal","category":"Jet ski & motor water sports","environment":"Outdoor / water","status":"Active / seasonal","suppressed":false,"nowFit":"High","priority":"P2","familyData":"Possible / verify","lastVerified":"2026-08-18","contact":{"phone":null,"bookingUrl":null},"commercial":{"priceText":null,"ageRulesText":null},"accessibility":{"status":"Not publicly verified","mobilityEvidence":null,"confidence":"Low"},"trust":{"evidenceGrade":"A","sourceUrls":[],"ownerConfirmed":false,"hoyVerified":false,"liveToday":false},"geo":{"mapUrl":null,"lat":null,"lng":null}},{"id":83,"slug":"83-las-charcas-mud-baths","name":"Las Charcas / Mud Baths","entityType":"Place","locality":"San Pedro del Pinatar","category":"Wellness & nature","environment":"Outdoor / water","status":"Active","suppressed":false,"nowFit":"High","priority":"P2","familyData":"Yes","lastVerified":"2026-08-18","contact":{"phone":null,"bookingUrl":null},"commercial":{"priceText":null,"ageRulesText":null},"accessibility":{"status":"Partly verified – access infrastructure improved 2026","mobilityEvidence":null,"confidence":"High"},"trust":{"evidenceGrade":"A","sourceUrls":[],"ownerConfirmed":false,"hoyVerified":false,"liveToday":false},"geo":{"mapUrl":null,"lat":null,"lng":null}},{"id":84,"slug":"84-salinas-y-arenales-de-san-pedro-del-pinatar","name":"Salinas y Arenales de San Pedro del Pinatar","entityType":"Place","locality":"San Pedro del Pinatar","category":"Nature & hiking","environment":"Outdoor / nature","status":"Active","suppressed":false,"nowFit":"High","priority":"P2","familyData":"Yes","lastVerified":"2026-08-18","contact":{"phone":null,"bookingUrl":null},"commercial":{"priceText":null,"ageRulesText":null},"accessibility":{"status":"Natural terrain / not audited","mobilityEvidence":null,"confidence":"Medium"},"trust":{"evidenceGrade":"A","sourceUrls":[],"ownerConfirmed":false,"hoyVerified":false,"liveToday":false},"geo":{"mapUrl":null,"lat":null,"lng":null}},{"id":85,"slug":"85-ferry-san-pedro-la-manga","name":"Ferry San Pedro – La Manga","entityType":"Provider","locality":"San Pedro del Pinatar","category":"Boat transport / excursion","environment":"Outdoor / water","status":"Active / seasonal timetable","suppressed":false,"nowFit":"High","priority":"P1","familyData":"Yes","lastVerified":"2026-08-18","contact":{"phone":null,"bookingUrl":"https://www.marmenorferry.com/ferry-mar-menor.html"},"commercial":{"priceText":null,"ageRulesText":null},"accessibility":{"status":"Not publicly verified","mobilityEvidence":null,"confidence":"Low"},"trust":{"evidenceGrade":"A","sourceUrls":["https://www.marmenorferry.com/ferry-mar-menor.html"],"ownerConfirmed":false,"hoyVerified":false,"liveToday":false},"geo":{"mapUrl":null,"lat":null,"lng":null}},{"id":86,"slug":"86-ciclos-jr-rent-bike-jr","name":"CICLOS JR & RENT-BIKE JR","entityType":"Provider","locality":"San Pedro del Pinatar","category":"Cycling & mobility","environment":"Outdoor / land","status":"Active","suppressed":false,"nowFit":"Medium","priority":"P3","familyData":"Yes","lastVerified":"2026-08-18","contact":{"phone":null,"bookingUrl":null},"commercial":{"priceText":null,"ageRulesText":null},"accessibility":{"status":"Not publicly verified","mobilityEvidence":null,"confidence":"Low"},"trust":{"evidenceGrade":"C","sourceUrls":[],"ownerConfirmed":false,"hoyVerified":false,"liveToday":false},"geo":{"mapUrl":null,"lat":null,"lng":null}},{"id":87,"slug":"87-fun-in-mar-menor","name":"Fun in Mar Menor","entityType":"Provider","locality":"Los Alcázares","category":"Kayak / SUP / adventure","environment":"Outdoor / water","status":"Active","suppressed":false,"nowFit":"Medium","priority":"P3","familyData":"Yes","lastVerified":"2026-08-18","contact":{"phone":null,"bookingUrl":null},"commercial":{"priceText":null,"ageRulesText":null},"accessibility":{"status":"Not publicly verified","mobilityEvidence":null,"confidence":"Low"},"trust":{"evidenceGrade":"C","sourceUrls":[],"ownerConfirmed":false,"hoyVerified":false,"liveToday":false},"geo":{"mapUrl":null,"lat":null,"lng":null}},{"id":88,"slug":"88-sailing-association-of-the-mar-menor","name":"Sailing Association of the Mar Menor","entityType":"Provider","locality":"Los Alcázares","category":"Water sports school","environment":"Outdoor / water","status":"Active","suppressed":false,"nowFit":"Medium","priority":"P3","familyData":"Yes","lastVerified":"2026-08-18","contact":{"phone":null,"bookingUrl":null},"commercial":{"priceText":null,"ageRulesText":null},"accessibility":{"status":"Not publicly verified","mobilityEvidence":null,"confidence":"Low"},"trust":{"evidenceGrade":"C","sourceUrls":[],"ownerConfirmed":false,"hoyVerified":false,"liveToday":false},"geo":{"mapUrl":null,"lat":null,"lng":null}},{"id":89,"slug":"89-el-habanero-tren-turistico","name":"El Habanero Tren Turístico","entityType":"Provider","locality":"Los Alcázares","category":"Family & sightseeing","environment":"Outdoor","status":"Active / seasonal","suppressed":false,"nowFit":"High","priority":"P3","familyData":"Yes","lastVerified":"2026-08-18","contact":{"phone":null,"bookingUrl":null},"commercial":{"priceText":null,"ageRulesText":null},"accessibility":{"status":"Not publicly verified","mobilityEvidence":null,"confidence":"Low"},"trust":{"evidenceGrade":"B","sourceUrls":[],"ownerConfirmed":false,"hoyVerified":false,"liveToday":false},"geo":{"mapUrl":null,"lat":null,"lng":null}},{"id":90,"slug":"90-vidampark","name":"VIDÁMPARK","entityType":"Provider","locality":"Los Alcázares","category":"Family & amusement","environment":"Outdoor / amusement","status":"Active / seasonal","suppressed":false,"nowFit":"High","priority":"P3","familyData":"Yes","lastVerified":"2026-08-18","contact":{"phone":null,"bookingUrl":null},"commercial":{"priceText":null,"ageRulesText":null},"accessibility":{"status":"Not publicly verified","mobilityEvidence":null,"confidence":"Low"},"trust":{"evidenceGrade":"C","sourceUrls":[],"ownerConfirmed":false,"hoyVerified":false,"liveToday":false},"geo":{"mapUrl":null,"lat":null,"lng":null}}]