[{"id":61,"slug":"61-la-manga-adventure-golf","name":"La Manga Adventure Golf","entityType":"Provider","locality":"Cabo de Palos / Playa Honda","category":"Family & amusement","environment":"Outdoor","status":"Active","suppressed":false,"nowFit":"High","priority":"P1","familyData":"Yes","lastVerified":"2026-08-18","contact":{"phone":"+34 693 934 381","bookingUrl":null},"commercial":{"priceText":null,"ageRulesText":null},"accessibility":{"status":"Not publicly verified","mobilityEvidence":null,"confidence":"Low"},"trust":{"evidenceGrade":"B","sourceUrls":["https://murciatoday.com/la-manga-adventure-golf-fun-for-all-the-family-near-to-playa-honda-and-cabo-de-palos_1617187-a.html"],"ownerConfirmed":false,"hoyVerified":false,"liveToday":false},"geo":{"mapUrl":null,"lat":null,"lng":null}},{"id":62,"slug":"62-bakour-la-manga-splash-water-park","name":"Bakour La Manga Splash Water Park","entityType":"Experience","locality":"La Manga","category":"Family & amusement","environment":"Outdoor / water park","status":"Active / availability-based","suppressed":false,"nowFit":"High","priority":"P1","familyData":"Yes","lastVerified":"2026-08-18","contact":{"phone":"+34 868 785 266","bookingUrl":"https://www.bakourhotels.com/en/our-hotels/bakour-la-manga-splash/water-park"},"commercial":{"priceText":null,"ageRulesText":null},"accessibility":{"status":"Not publicly verified","mobilityEvidence":null,"confidence":"Low"},"trust":{"evidenceGrade":"A","sourceUrls":["https://www.bakourhotels.com/en/our-hotels/bakour-la-manga-splash/water-park"],"ownerConfirmed":false,"hoyVerified":false,"liveToday":false},"geo":{"mapUrl":null,"lat":null,"lng":null}},{"id":63,"slug":"63-polideportivo-la-manga-del-mar-menor","name":"Polideportivo La Manga del Mar Menor","entityType":"Place","locality":"La Manga","category":"Sports facilities","environment":"Indoor / outdoor","status":"Active","suppressed":false,"nowFit":"Medium","priority":"P3","familyData":"Yes","lastVerified":"2026-08-18","contact":{"phone":null,"bookingUrl":null},"commercial":{"priceText":null,"ageRulesText":null},"accessibility":{"status":"Not publicly verified","mobilityEvidence":null,"confidence":"Low"},"trust":{"evidenceGrade":"A","sourceUrls":[],"ownerConfirmed":false,"hoyVerified":false,"liveToday":false},"geo":{"mapUrl":null,"lat":null,"lng":null}},{"id":64,"slug":"64-calblanque-regional-park","name":"Calblanque Regional Park","entityType":"Place","locality":"Calblanque","category":"Nature & hiking","environment":"Outdoor / nature","status":"Active","suppressed":false,"nowFit":"High","priority":"P1","familyData":"Yes","lastVerified":"2026-08-18","contact":{"phone":"+34 968 228 984","bookingUrl":"https://calblanque440.carm.es/en/"},"commercial":{"priceText":null,"ageRulesText":null},"accessibility":{"status":"Natural terrain / partly supported access","mobilityEvidence":null,"confidence":"High"},"trust":{"evidenceGrade":"A","sourceUrls":["https://calblanque440.carm.es/en/precios-horarios/"],"ownerConfirmed":false,"hoyVerified":false,"liveToday":false},"geo":{"mapUrl":null,"lat":null,"lng":null}},{"id":65,"slug":"65-playas-de-calblanque","name":"Playas de Calblanque","entityType":"Place","locality":"Calblanque","category":"Beaches & nature","environment":"Outdoor / beach","status":"Active","suppressed":false,"nowFit":"High","priority":"P1","familyData":"Yes","lastVerified":"2026-08-18","contact":{"phone":null,"bookingUrl":"https://calblanque440.carm.es/en/"},"commercial":{"priceText":null,"ageRulesText":null},"accessibility":{"status":"Natural terrain / not audited","mobilityEvidence":null,"confidence":"Low"},"trust":{"evidenceGrade":"A","sourceUrls":["https://www.turismoregiondemurcia.es/es/playa/playas-de-calblanque-590/"],"ownerConfirmed":false,"hoyVerified":false,"liveToday":false},"geo":{"mapUrl":null,"lat":null,"lng":null}},{"id":66,"slug":"66-guided-hiking-calblanque","name":"Guided Hiking Calblanque","entityType":"Experience","locality":"Calblanque","category":"Nature & hiking","environment":"Outdoor / nature","status":"Active / schedule-based","suppressed":false,"nowFit":"High","priority":"P1","familyData":"Yes","lastVerified":"2026-08-18","contact":{"phone":null,"bookingUrl":"https://turismoazul.turismoregiondemurcia.es/turismoazul/es/experiencias/senderismo-guiado-por-el-parque-regional-de-calblanque"},"commercial":{"priceText":null,"ageRulesText":null},"accessibility":{"status":"Natural terrain / not audited","mobilityEvidence":null,"confidence":"Low"},"trust":{"evidenceGrade":"A","sourceUrls":["https://turismoazul.turismoregiondemurcia.es/turismoazul/es/experiencias/senderismo-guiado-por-el-parque-regional-de-calblanque"],"ownerConfirmed":false,"hoyVerified":false,"liveToday":false},"geo":{"mapUrl":null,"lat":null,"lng":null}},{"id":67,"slug":"67-kayak-cala-reonacalblanque-route","name":"Kayak Cala Reona–Calblanque Route","entityType":"Experience","locality":"Cala Reona / Calblanque","category":"Kayak / nature","environment":"Outdoor / water","status":"Active","suppressed":false,"nowFit":"Medium","priority":"P2","familyData":"Possible / verify","lastVerified":"2026-08-18","contact":{"phone":null,"bookingUrl":null},"commercial":{"priceText":null,"ageRulesText":null},"accessibility":{"status":"Natural terrain / not audited","mobilityEvidence":null,"confidence":"Medium"},"trust":{"evidenceGrade":"A","sourceUrls":[],"ownerConfirmed":false,"hoyVerified":false,"liveToday":false},"geo":{"mapUrl":null,"lat":null,"lng":null}},{"id":68,"slug":"68-sendero-azul-la-mangacabo-de-palos","name":"Sendero Azul La Manga–Cabo de Palos","entityType":"Place/Route","locality":"La Manga / Cabo de Palos","category":"Nature & hiking","environment":"Outdoor / land","status":"Active","suppressed":false,"nowFit":"High","priority":"P1","familyData":"Yes","lastVerified":"2026-08-18","contact":{"phone":null,"bookingUrl":"https://www.turismoregiondemurcia.es/es/ruta/sendero-azul-la-manga--cabo-de-palos-2401/"},"commercial":{"priceText":null,"ageRulesText":null},"accessibility":{"status":"Natural terrain / not audited","mobilityEvidence":null,"confidence":"Low"},"trust":{"evidenceGrade":"A","sourceUrls":["https://www.turismoregiondemurcia.es/es/ruta/sendero-azul-la-manga--cabo-de-palos-2401/"],"ownerConfirmed":false,"hoyVerified":false,"liveToday":false},"geo":{"mapUrl":null,"lat":null,"lng":null}},{"id":69,"slug":"69-faro-de-cabo-de-palos","name":"Faro de Cabo de Palos","entityType":"Place","locality":"Cabo de Palos","category":"Culture & sightseeing","environment":"Outdoor / sightseeing","status":"Active","suppressed":false,"nowFit":"High","priority":"P1","familyData":"Possible / verify","lastVerified":"2026-08-18","contact":{"phone":"+34 968 128 955","bookingUrl":"https://www.turismoregiondemurcia.es/es/monumento/faro-de-cabo-de-palos-243/"},"commercial":{"priceText":null,"ageRulesText":null},"accessibility":{"status":"Partly verified","mobilityEvidence":null,"confidence":"High"},"trust":{"evidenceGrade":"A","sourceUrls":["https://www.turismoregiondemurcia.es/es/monumento/faro-de-cabo-de-palos-243/"],"ownerConfirmed":false,"hoyVerified":false,"liveToday":false},"geo":{"mapUrl":null,"lat":null,"lng":null}},{"id":70,"slug":"70-mirador-faro-de-cabo-de-palos","name":"Mirador Faro de Cabo de Palos","entityType":"Place","locality":"Cabo de Palos","category":"Viewpoints","environment":"Outdoor","status":"Active","suppressed":false,"nowFit":"High","priority":"P2","familyData":"Possible / verify","lastVerified":"2026-08-18","contact":{"phone":null,"bookingUrl":null},"commercial":{"priceText":null,"ageRulesText":null},"accessibility":{"status":"Natural terrain / not audited","mobilityEvidence":null,"confidence":"Low"},"trust":{"evidenceGrade":"B","sourceUrls":[],"ownerConfirmed":false,"hoyVerified":false,"liveToday":false},"geo":{"mapUrl":null,"lat":null,"lng":null}}]