[{"id":31,"slug":"31-nautical-ark-la-manga","name":"Nautical Ark La Manga","entityType":"Provider","locality":"Puerto Tomás Maestre","category":"Boat rental & charter","environment":"Outdoor / water","status":"Active","suppressed":false,"nowFit":"High","priority":"P2","familyData":"Possible / verify","lastVerified":"2026-08-18","contact":{"phone":null,"bookingUrl":null},"commercial":{"priceText":null,"ageRulesText":null},"accessibility":{"status":"Not publicly verified","mobilityEvidence":null,"confidence":"Low"},"trust":{"evidenceGrade":"C","sourceUrls":[],"ownerConfirmed":false,"hoyVerified":false,"liveToday":false},"geo":{"mapUrl":null,"lat":null,"lng":null}},{"id":32,"slug":"32-blue-beach-charter","name":"BLUE BEACH CHARTER","entityType":"Provider","locality":"La Manga","category":"Boat rental & charter","environment":"Outdoor / water","status":"Active","suppressed":false,"nowFit":"High","priority":"P2","familyData":"Yes","lastVerified":"2026-08-18","contact":{"phone":null,"bookingUrl":null},"commercial":{"priceText":null,"ageRulesText":null},"accessibility":{"status":"Not publicly verified","mobilityEvidence":null,"confidence":"Low"},"trust":{"evidenceGrade":"B","sourceUrls":[],"ownerConfirmed":false,"hoyVerified":false,"liveToday":false},"geo":{"mapUrl":null,"lat":null,"lng":null}},{"id":33,"slug":"33-alina-sailing","name":"ALINA SAILING","entityType":"Provider","locality":"Puerto Tomás Maestre","category":"Boat excursions","environment":"Outdoor / water","status":"Active","suppressed":false,"nowFit":"High","priority":"P2","familyData":"Yes","lastVerified":"2026-08-18","contact":{"phone":null,"bookingUrl":null},"commercial":{"priceText":null,"ageRulesText":null},"accessibility":{"status":"Not publicly verified","mobilityEvidence":null,"confidence":"Low"},"trust":{"evidenceGrade":"B","sourceUrls":[],"ownerConfirmed":false,"hoyVerified":false,"liveToday":false},"geo":{"mapUrl":null,"lat":null,"lng":null}},{"id":34,"slug":"34-djinn-charter","name":"Djinn Charter","entityType":"Provider","locality":"Cabo de Palos","category":"Boat rental & charter","environment":"Outdoor / water","status":"Active","suppressed":false,"nowFit":"High","priority":"P1","familyData":"Yes","lastVerified":"2026-08-18","contact":{"phone":"+34 607 233 492","bookingUrl":"https://www.djinncharter.com/en/home/"},"commercial":{"priceText":null,"ageRulesText":null},"accessibility":{"status":"Not publicly verified","mobilityEvidence":null,"confidence":"Low"},"trust":{"evidenceGrade":"B","sourceUrls":["https://www.djinncharter.com/en/tours/"],"ownerConfirmed":false,"hoyVerified":false,"liveToday":false},"geo":{"mapUrl":null,"lat":null,"lng":null}},{"id":35,"slug":"35-jade-sailing","name":"Jade Sailing","entityType":"Provider","locality":"Cabo de Palos","category":"Boat rental & charter","environment":"Outdoor / water","status":"Active","suppressed":false,"nowFit":"High","priority":"P2","familyData":"Possible / verify","lastVerified":"2026-08-18","contact":{"phone":null,"bookingUrl":null},"commercial":{"priceText":null,"ageRulesText":null},"accessibility":{"status":"Not publicly verified","mobilityEvidence":null,"confidence":"Low"},"trust":{"evidenceGrade":"B","sourceUrls":[],"ownerConfirmed":false,"hoyVerified":false,"liveToday":false},"geo":{"mapUrl":null,"lat":null,"lng":null}},{"id":36,"slug":"36-velero-antidoto-charter","name":"Velero Antídoto Charter","entityType":"Provider","locality":"Cabo de Palos","category":"Boat rental & charter","environment":"Outdoor / water","status":"Active","suppressed":false,"nowFit":"High","priority":"P2","familyData":"Possible / verify","lastVerified":"2026-08-18","contact":{"phone":null,"bookingUrl":null},"commercial":{"priceText":null,"ageRulesText":null},"accessibility":{"status":"Not publicly verified","mobilityEvidence":null,"confidence":"Low"},"trust":{"evidenceGrade":"C","sourceUrls":[],"ownerConfirmed":false,"hoyVerified":false,"liveToday":false},"geo":{"mapUrl":null,"lat":null,"lng":null}},{"id":37,"slug":"37-charter-santa-cruz-ii","name":"Charter Santa Cruz II","entityType":"Provider","locality":"Puerto Tomás Maestre","category":"Fishing charters","environment":"Outdoor / water","status":"Active","suppressed":false,"nowFit":"High","priority":"P2","familyData":"Yes","lastVerified":"2026-08-18","contact":{"phone":null,"bookingUrl":null},"commercial":{"priceText":null,"ageRulesText":null},"accessibility":{"status":"Not publicly verified","mobilityEvidence":null,"confidence":"Low"},"trust":{"evidenceGrade":"A","sourceUrls":[],"ownerConfirmed":false,"hoyVerified":false,"liveToday":false},"geo":{"mapUrl":null,"lat":null,"lng":null}},{"id":38,"slug":"38-hobbybike-la-manga","name":"HobbyBike La Manga","entityType":"Provider","locality":"La Manga","category":"Cycling & mobility","environment":"Outdoor / land","status":"Active","suppressed":false,"nowFit":"High","priority":"P1","familyData":"Yes","lastVerified":"2026-08-18","contact":{"phone":"+34 678 372 176","bookingUrl":null},"commercial":{"priceText":null,"ageRulesText":null},"accessibility":{"status":"Not publicly verified","mobilityEvidence":null,"confidence":"Low"},"trust":{"evidenceGrade":"B","sourceUrls":["https://www.google.com/maps/search/?api=1&query=HobbyBike%20La%20Manga"],"ownerConfirmed":false,"hoyVerified":false,"liveToday":false},"geo":{"mapUrl":null,"lat":null,"lng":null}},{"id":39,"slug":"39-ecomobike-iberica","name":"Ecomobike Ibérica","entityType":"Provider","locality":"La Manga","category":"Cycling & mobility","environment":"Outdoor / land","status":"Active","suppressed":false,"nowFit":"High","priority":"P2","familyData":"Yes","lastVerified":"2026-08-18","contact":{"phone":null,"bookingUrl":null},"commercial":{"priceText":null,"ageRulesText":null},"accessibility":{"status":"Not publicly verified","mobilityEvidence":null,"confidence":"Low"},"trust":{"evidenceGrade":"C","sourceUrls":[],"ownerConfirmed":false,"hoyVerified":false,"liveToday":false},"geo":{"mapUrl":null,"lat":null,"lng":null}},{"id":40,"slug":"40-sobikes-cabo-de-palos","name":"SOBIKES – Cabo de Palos","entityType":"Provider","locality":"Cabo de Palos","category":"Cycling & mobility","environment":"Outdoor / land","status":"Temporarily closed","suppressed":true,"nowFit":"Low","priority":"P3","familyData":"Yes","lastVerified":"2026-08-18","contact":{"phone":null,"bookingUrl":null},"commercial":{"priceText":null,"ageRulesText":null},"accessibility":{"status":"Not publicly verified","mobilityEvidence":null,"confidence":"Low"},"trust":{"evidenceGrade":"C","sourceUrls":[],"ownerConfirmed":false,"hoyVerified":false,"liveToday":false},"geo":{"mapUrl":null,"lat":null,"lng":null}}]