[{"id":101,"slug":"101-cartagena-hoppy-ebike-sharing-cabo-de-palos-la-manga","name":"Cartagena Hoppy E‑Bike Sharing – Cabo de Palos / La Manga","entityType":"Public mobility service","locality":"Cabo de Palos / La Manga","category":"Cycling & mobility","environment":"Outdoor / land","status":"Active","suppressed":false,"nowFit":"High","priority":"P1","familyData":"Possible / verify","lastVerified":"2026-08-18","contact":{"phone":null,"bookingUrl":"https://www.cartagena.es/"},"commercial":{"priceText":null,"ageRulesText":null},"accessibility":{"status":"Not publicly verified","mobilityEvidence":null,"confidence":"High"},"trust":{"evidenceGrade":"A","sourceUrls":["https://www.cartagena.es/"],"ownerConfirmed":false,"hoyVerified":false,"liveToday":false},"geo":{"mapUrl":null,"lat":null,"lng":null}}]