[{"id":71,"slug":"71-puerto-de-cabo-de-palos","name":"Puerto de Cabo de Palos","entityType":"Place","locality":"Cabo de Palos","category":"Culture & sightseeing","environment":"Outdoor","status":"Active","suppressed":false,"nowFit":"High","priority":"P1","familyData":"Possible / verify","lastVerified":"2026-08-18","contact":{"phone":null,"bookingUrl":"https://www.turismoregiondemurcia.es/es/lugar_de_interes/puerto-de-cabo-de-palos-8803/"},"commercial":{"priceText":null,"ageRulesText":null},"accessibility":{"status":"Not publicly verified","mobilityEvidence":null,"confidence":"Low"},"trust":{"evidenceGrade":"A","sourceUrls":["https://www.turismoregiondemurcia.es/es/lugar_de_interes/puerto-de-cabo-de-palos-8803/"],"ownerConfirmed":false,"hoyVerified":false,"liveToday":false},"geo":{"mapUrl":null,"lat":null,"lng":null}},{"id":72,"slug":"72-centro-de-documentacion-y-exposicion-de-cabo-de-palos","name":"Centro de Documentación y Exposición de Cabo de Palos","entityType":"Place","locality":"Cabo de Palos","category":"Culture & sightseeing","environment":"Indoor","status":"Active","suppressed":false,"nowFit":"High","priority":"P2","familyData":"Yes","lastVerified":"2026-08-18","contact":{"phone":null,"bookingUrl":null},"commercial":{"priceText":null,"ageRulesText":null},"accessibility":{"status":"Verified accessible","mobilityEvidence":null,"confidence":"High"},"trust":{"evidenceGrade":"A","sourceUrls":[],"ownerConfirmed":false,"hoyVerified":true,"liveToday":false},"geo":{"mapUrl":null,"lat":null,"lng":null}},{"id":73,"slug":"73-calas-de-cabo-de-palos","name":"Calas de Cabo de Palos","entityType":"Place","locality":"Cabo de Palos","category":"Beaches & snorkelling","environment":"Outdoor / water","status":"Active","suppressed":false,"nowFit":"High","priority":"P1","familyData":"Yes","lastVerified":"2026-08-18","contact":{"phone":null,"bookingUrl":"https://www.turismoregiondemurcia.es/es/playa/calas-de-cabo-de-palos-8804/"},"commercial":{"priceText":null,"ageRulesText":null},"accessibility":{"status":"Natural terrain / not audited","mobilityEvidence":null,"confidence":"Low"},"trust":{"evidenceGrade":"A","sourceUrls":["https://www.turismoregiondemurcia.es/es/playa/calas-de-cabo-de-palos-8804/"],"ownerConfirmed":false,"hoyVerified":false,"liveToday":false},"geo":{"mapUrl":null,"lat":null,"lng":null}},{"id":74,"slug":"74-playa-de-levante-cabo-de-palos","name":"Playa de Levante (Cabo de Palos)","entityType":"Place","locality":"Cabo de Palos","category":"Beaches & snorkelling","environment":"Outdoor / beach","status":"Active","suppressed":false,"nowFit":"High","priority":"P1","familyData":"Yes","lastVerified":"2026-08-18","contact":{"phone":null,"bookingUrl":"https://www.turismoregiondemurcia.es/es/playa/playa-de-levante-525/"},"commercial":{"priceText":null,"ageRulesText":null},"accessibility":{"status":"Verified accessible beach","mobilityEvidence":null,"confidence":"High"},"trust":{"evidenceGrade":"A","sourceUrls":["https://www.cartagena.es/detalle_noticias.asp?id=88744"],"ownerConfirmed":false,"hoyVerified":true,"liveToday":false},"geo":{"mapUrl":null,"lat":null,"lng":null}},{"id":75,"slug":"75-cala-de-la-galera","name":"Cala de la Galera","entityType":"Place","locality":"Cabo de Palos","category":"Beaches & viewpoints","environment":"Outdoor","status":"Active","suppressed":false,"nowFit":"Medium","priority":"P2","familyData":"Possible / verify","lastVerified":"2026-08-18","contact":{"phone":null,"bookingUrl":null},"commercial":{"priceText":null,"ageRulesText":null},"accessibility":{"status":"No step-free access indicated","mobilityEvidence":null,"confidence":"Medium"},"trust":{"evidenceGrade":"B","sourceUrls":[],"ownerConfirmed":false,"hoyVerified":false,"liveToday":false},"geo":{"mapUrl":null,"lat":null,"lng":null}},{"id":76,"slug":"76-cala-major","name":"Cala Major","entityType":"Place","locality":"Cabo de Palos","category":"Beaches & viewpoints","environment":"Outdoor","status":"Active","suppressed":false,"nowFit":"Medium","priority":"P2","familyData":"Possible / verify","lastVerified":"2026-08-18","contact":{"phone":null,"bookingUrl":null},"commercial":{"priceText":null,"ageRulesText":null},"accessibility":{"status":"Natural terrain / not audited","mobilityEvidence":null,"confidence":"Low"},"trust":{"evidenceGrade":"B","sourceUrls":[],"ownerConfirmed":false,"hoyVerified":false,"liveToday":false},"geo":{"mapUrl":null,"lat":null,"lng":null}},{"id":77,"slug":"77-cabo-de-palos-sunday-market","name":"Cabo de Palos Sunday Market","entityType":"Place/Event","locality":"Cabo de Palos","category":"Markets & local experiences","environment":"Outdoor / market","status":"Active","suppressed":false,"nowFit":"High","priority":"P1","familyData":"Possible / verify","lastVerified":"2026-08-18","contact":{"phone":null,"bookingUrl":"https://www.cartagena.es/mercadillos.asp"},"commercial":{"priceText":null,"ageRulesText":null},"accessibility":{"status":"Not publicly verified","mobilityEvidence":null,"confidence":"Low"},"trust":{"evidenceGrade":"A","sourceUrls":["https://www.cartagena.es/mercadillos.asp"],"ownerConfirmed":false,"hoyVerified":false,"liveToday":false},"geo":{"mapUrl":null,"lat":null,"lng":null}},{"id":78,"slug":"78-cueva-de-los-belones","name":"Cueva de los Belones","entityType":"Place","locality":"Los Belones","category":"Nature & hiking","environment":"Outdoor","status":"Active / verify access","suppressed":false,"nowFit":"Low","priority":"P3","familyData":"Possible / verify","lastVerified":"2026-08-18","contact":{"phone":null,"bookingUrl":null},"commercial":{"priceText":null,"ageRulesText":null},"accessibility":{"status":"Natural terrain / not audited","mobilityEvidence":null,"confidence":"Low"},"trust":{"evidenceGrade":"C","sourceUrls":[],"ownerConfirmed":false,"hoyVerified":false,"liveToday":false},"geo":{"mapUrl":null,"lat":null,"lng":null}},{"id":79,"slug":"79-adventure-divers-activity-center","name":"Adventure Divers & Activity Center","entityType":"Provider","locality":"Atamaría / La Manga Club","category":"Diving & water activities","environment":"Outdoor / water","status":"Active","suppressed":false,"nowFit":"Medium","priority":"P2","familyData":"Yes","lastVerified":"2026-08-18","contact":{"phone":null,"bookingUrl":null},"commercial":{"priceText":null,"ageRulesText":null},"accessibility":{"status":"Not publicly verified","mobilityEvidence":null,"confidence":"Low"},"trust":{"evidenceGrade":"A","sourceUrls":[],"ownerConfirmed":false,"hoyVerified":false,"liveToday":false},"geo":{"mapUrl":null,"lat":null,"lng":null}},{"id":80,"slug":"80-provela-academy","name":"Provela Academy","entityType":"Provider","locality":"Mar de Cristal","category":"Water sports school","environment":"Outdoor / water","status":"Active","suppressed":false,"nowFit":"Medium","priority":"P2","familyData":"Yes","lastVerified":"2026-08-18","contact":{"phone":null,"bookingUrl":null},"commercial":{"priceText":null,"ageRulesText":null},"accessibility":{"status":"Not publicly verified","mobilityEvidence":null,"confidence":"Low"},"trust":{"evidenceGrade":"C","sourceUrls":[],"ownerConfirmed":false,"hoyVerified":false,"liveToday":false},"geo":{"mapUrl":null,"lat":null,"lng":null}}]