[{"id":51,"slug":"51-padel-los-belones","name":"Padel Los Belones","entityType":"Provider","locality":"Los Belones","category":"Racquet sports","environment":"Outdoor / sports","status":"Active","suppressed":false,"nowFit":"Medium","priority":"P3","familyData":"Possible / verify","lastVerified":"2026-08-18","contact":{"phone":null,"bookingUrl":null},"commercial":{"priceText":null,"ageRulesText":null},"accessibility":{"status":"Not publicly verified","mobilityEvidence":null,"confidence":"Low"},"trust":{"evidenceGrade":"C","sourceUrls":[],"ownerConfirmed":false,"hoyVerified":false,"liveToday":false},"geo":{"mapUrl":null,"lat":null,"lng":null}},{"id":52,"slug":"52-the-racquets-club","name":"The Racquets Club","entityType":"Provider","locality":"La Manga Club","category":"Racquet sports","environment":"Indoor / outdoor sports","status":"Active","suppressed":false,"nowFit":"High","priority":"P1","familyData":"Yes","lastVerified":"2026-08-18","contact":{"phone":"+34 968 970 704","bookingUrl":"https://www.lmctennis.com/price-list"},"commercial":{"priceText":null,"ageRulesText":null},"accessibility":{"status":"Not publicly verified","mobilityEvidence":null,"confidence":"Low"},"trust":{"evidenceGrade":"A","sourceUrls":["https://www.lmctennis.com/price-list"],"ownerConfirmed":false,"hoyVerified":false,"liveToday":false},"geo":{"mapUrl":null,"lat":null,"lng":null}},{"id":53,"slug":"53-la-manga-club-golf","name":"La Manga Club Golf","entityType":"Provider","locality":"La Manga Club","category":"Golf","environment":"Outdoor / sports","status":"Active","suppressed":false,"nowFit":"High","priority":"P1","familyData":"Yes","lastVerified":"2026-08-18","contact":{"phone":"+34 968 331 234","bookingUrl":"https://www.lamangaclub.com/en/sports/golf/"},"commercial":{"priceText":null,"ageRulesText":null},"accessibility":{"status":"Not publicly verified","mobilityEvidence":null,"confidence":"Low"},"trust":{"evidenceGrade":"A","sourceUrls":["https://www.lamangaclub.com/en/sports/golf/"],"ownerConfirmed":false,"hoyVerified":false,"liveToday":false},"geo":{"mapUrl":null,"lat":null,"lng":null}},{"id":54,"slug":"54-la-manga-club-football-centre","name":"La Manga Club Football Centre","entityType":"Provider","locality":"La Manga Club","category":"Football","environment":"Outdoor / sports","status":"Active","suppressed":false,"nowFit":"Medium","priority":"P2","familyData":"Possible / verify","lastVerified":"2026-08-18","contact":{"phone":null,"bookingUrl":null},"commercial":{"priceText":null,"ageRulesText":null},"accessibility":{"status":"Not publicly verified","mobilityEvidence":null,"confidence":"Medium"},"trust":{"evidenceGrade":"A","sourceUrls":[],"ownerConfirmed":false,"hoyVerified":false,"liveToday":false},"geo":{"mapUrl":null,"lat":null,"lng":null}},{"id":55,"slug":"55-la-manga-club-junior-football-academy","name":"La Manga Club Junior Football Academy","entityType":"Experience","locality":"La Manga Club","category":"Football","environment":"Outdoor / sports","status":"Active / seasonal","suppressed":false,"nowFit":"High","priority":"P2","familyData":"Yes","lastVerified":"2026-08-18","contact":{"phone":null,"bookingUrl":null},"commercial":{"priceText":null,"ageRulesText":null},"accessibility":{"status":"Not publicly verified","mobilityEvidence":null,"confidence":"Medium"},"trust":{"evidenceGrade":"A","sourceUrls":[],"ownerConfirmed":false,"hoyVerified":false,"liveToday":false},"geo":{"mapUrl":null,"lat":null,"lng":null}},{"id":56,"slug":"56-alma-spa","name":"Alma Spa","entityType":"Provider","locality":"La Manga Club","category":"Fitness & wellness","environment":"Indoor","status":"Active","suppressed":false,"nowFit":"High","priority":"P1","familyData":"Possible / verify","lastVerified":"2026-08-18","contact":{"phone":null,"bookingUrl":"https://www.lamangaclub.com/en/spa/"},"commercial":{"priceText":null,"ageRulesText":null},"accessibility":{"status":"Not publicly verified","mobilityEvidence":null,"confidence":"Low"},"trust":{"evidenceGrade":"A","sourceUrls":["https://www.lamangaclub.com/en/spa/"],"ownerConfirmed":false,"hoyVerified":false,"liveToday":false},"geo":{"mapUrl":null,"lat":null,"lng":null}},{"id":57,"slug":"57-club-hipico-finca-cal-y-canto","name":"Club Hípico Finca Cal y Canto","entityType":"Provider","locality":"Los Belones","category":"Horse riding","environment":"Outdoor / land","status":"Active","suppressed":false,"nowFit":"Medium","priority":"P2","familyData":"Yes","lastVerified":"2026-08-18","contact":{"phone":null,"bookingUrl":null},"commercial":{"priceText":null,"ageRulesText":null},"accessibility":{"status":"Inclusive indicator / direct confirmation required","mobilityEvidence":null,"confidence":"Medium"},"trust":{"evidenceGrade":"B","sourceUrls":[],"ownerConfirmed":false,"hoyVerified":false,"liveToday":false},"geo":{"mapUrl":null,"lat":null,"lng":null}},{"id":58,"slug":"58-rancho-de-la-fuente","name":"Rancho de la Fuente","entityType":"Provider","locality":"Las Barracas / La Manga Club","category":"Horse riding","environment":"Outdoor / land","status":"Active / verify","suppressed":false,"nowFit":"High","priority":"P1","familyData":"Yes","lastVerified":"2026-08-18","contact":{"phone":"+34 618 966 326","bookingUrl":"https://www.facebook.com/RanchoLaFuente/"},"commercial":{"priceText":null,"ageRulesText":null},"accessibility":{"status":"Not publicly verified","mobilityEvidence":null,"confidence":"Low"},"trust":{"evidenceGrade":"B","sourceUrls":["https://www.yumping.com/en/horse-riding/rancho-de-la-fuente--e19740916"],"ownerConfirmed":false,"hoyVerified":false,"liveToday":false},"geo":{"mapUrl":null,"lat":null,"lng":null}},{"id":59,"slug":"59-la-manga-gokart","name":"La Manga Gokart","entityType":"Provider","locality":"Cabo de Palos / La Manga entrance","category":"Family & amusement","environment":"Outdoor / indoor","status":"Active","suppressed":false,"nowFit":"High","priority":"P1","familyData":"Yes","lastVerified":"2026-08-18","contact":{"phone":"+34 968 563 643","bookingUrl":"https://lamangagokart.es/"},"commercial":{"priceText":null,"ageRulesText":null},"accessibility":{"status":"Adaptive kart reported / direct confirmation required","mobilityEvidence":null,"confidence":"Medium"},"trust":{"evidenceGrade":"A","sourceUrls":["https://lamangagokart.es/"],"ownerConfirmed":false,"hoyVerified":false,"liveToday":false},"geo":{"mapUrl":null,"lat":null,"lng":null}},{"id":60,"slug":"60-peke-park-la-manga","name":"Peke Park La Manga","entityType":"Provider","locality":"La Manga","category":"Family & amusement","environment":"Outdoor / amusement","status":"Active","suppressed":false,"nowFit":"High","priority":"P1","familyData":"Yes","lastVerified":"2026-08-18","contact":{"phone":"+34 618 620 407","bookingUrl":"https://www.pekeparklamanga.com/"},"commercial":{"priceText":null,"ageRulesText":null},"accessibility":{"status":"Not publicly verified","mobilityEvidence":null,"confidence":"Low"},"trust":{"evidenceGrade":"A","sourceUrls":["https://www.pekeparklamanga.com/"],"ownerConfirmed":false,"hoyVerified":false,"liveToday":false},"geo":{"mapUrl":null,"lat":null,"lng":null}}]