[{"id":41,"slug":"41-murcia-bike-hire","name":"Murcia Bike Hire","entityType":"Provider","locality":"La Manga Club / Mar Menor","category":"Cycling & mobility","environment":"Outdoor / land","status":"Brand transition / duplicate candidate","suppressed":false,"nowFit":"Medium","priority":"P2","familyData":"Possible / verify","lastVerified":"2026-08-18","contact":{"phone":null,"bookingUrl":null},"commercial":{"priceText":null,"ageRulesText":null},"accessibility":{"status":"Not publicly verified","mobilityEvidence":null,"confidence":"Low"},"trust":{"evidenceGrade":"A","sourceUrls":[],"ownerConfirmed":false,"hoyVerified":false,"liveToday":false},"geo":{"mapUrl":null,"lat":null,"lng":null}},{"id":42,"slug":"42-orimar-bikes","name":"OriMar Bikes","entityType":"Provider","locality":"La Manga Club / Mar Menor","category":"Cycling & mobility","environment":"Outdoor / land","status":"Active","suppressed":false,"nowFit":"Medium","priority":"P2","familyData":"Possible / verify","lastVerified":"2026-08-18","contact":{"phone":null,"bookingUrl":null},"commercial":{"priceText":null,"ageRulesText":null},"accessibility":{"status":"Not publicly verified","mobilityEvidence":null,"confidence":"Low"},"trust":{"evidenceGrade":"A","sourceUrls":[],"ownerConfirmed":false,"hoyVerified":false,"liveToday":false},"geo":{"mapUrl":null,"lat":null,"lng":null}},{"id":43,"slug":"43-gym-la-manga-arena","name":"Gym La Manga Arena","entityType":"Provider","locality":"La Manga","category":"Fitness & wellness","environment":"Indoor","status":"Active","suppressed":false,"nowFit":"High","priority":"P2","familyData":"Possible / verify","lastVerified":"2026-08-18","contact":{"phone":null,"bookingUrl":null},"commercial":{"priceText":null,"ageRulesText":null},"accessibility":{"status":"Not publicly verified","mobilityEvidence":null,"confidence":"Low"},"trust":{"evidenceGrade":"C","sourceUrls":[],"ownerConfirmed":false,"hoyVerified":false,"liveToday":false},"geo":{"mapUrl":null,"lat":null,"lng":null}},{"id":44,"slug":"44-qualife","name":"Qualife","entityType":"Provider","locality":"La Manga","category":"Fitness & wellness","environment":"Indoor","status":"Active","suppressed":false,"nowFit":"High","priority":"P2","familyData":"Possible / verify","lastVerified":"2026-08-18","contact":{"phone":null,"bookingUrl":null},"commercial":{"priceText":null,"ageRulesText":null},"accessibility":{"status":"Not publicly verified","mobilityEvidence":null,"confidence":"Low"},"trust":{"evidenceGrade":"A","sourceUrls":[],"ownerConfirmed":false,"hoyVerified":false,"liveToday":false},"geo":{"mapUrl":null,"lat":null,"lng":null}},{"id":45,"slug":"45-om-my-soul-centro-de-bienestar","name":"OM my Soul! Centro de Bienestar","entityType":"Provider","locality":"La Manga","category":"Fitness & wellness","environment":"Indoor / outdoor","status":"Active","suppressed":false,"nowFit":"Medium","priority":"P2","familyData":"Possible / verify","lastVerified":"2026-08-18","contact":{"phone":null,"bookingUrl":null},"commercial":{"priceText":null,"ageRulesText":null},"accessibility":{"status":"Not publicly verified","mobilityEvidence":null,"confidence":"Low"},"trust":{"evidenceGrade":"A","sourceUrls":[],"ownerConfirmed":false,"hoyVerified":false,"liveToday":false},"geo":{"mapUrl":null,"lat":null,"lng":null}},{"id":46,"slug":"46-bloom-air-yoga","name":"Bloom Air Yoga","entityType":"Provider","locality":"La Manga","category":"Fitness & wellness","environment":"Indoor","status":"Active","suppressed":false,"nowFit":"Medium","priority":"P2","familyData":"Possible / verify","lastVerified":"2026-08-18","contact":{"phone":null,"bookingUrl":null},"commercial":{"priceText":null,"ageRulesText":null},"accessibility":{"status":"Not publicly verified","mobilityEvidence":null,"confidence":"Low"},"trust":{"evidenceGrade":"C","sourceUrls":[],"ownerConfirmed":false,"hoyVerified":false,"liveToday":false},"geo":{"mapUrl":null,"lat":null,"lng":null}},{"id":47,"slug":"47-kerala-experience","name":"Kerala Experience","entityType":"Provider","locality":"La Manga","category":"Fitness & wellness","environment":"Indoor","status":"Active","suppressed":false,"nowFit":"Medium","priority":"P3","familyData":"Possible / verify","lastVerified":"2026-08-18","contact":{"phone":null,"bookingUrl":null},"commercial":{"priceText":null,"ageRulesText":null},"accessibility":{"status":"Not publicly verified","mobilityEvidence":null,"confidence":"Low"},"trust":{"evidenceGrade":"B","sourceUrls":[],"ownerConfirmed":false,"hoyVerified":false,"liveToday":false},"geo":{"mapUrl":null,"lat":null,"lng":null}},{"id":48,"slug":"48-masaje-oriental-lee","name":"MASAJE ORIENTAL-LEE","entityType":"Provider","locality":"La Manga","category":"Fitness & wellness","environment":"Indoor","status":"Active","suppressed":false,"nowFit":"Medium","priority":"P3","familyData":"Possible / verify","lastVerified":"2026-08-18","contact":{"phone":null,"bookingUrl":null},"commercial":{"priceText":null,"ageRulesText":null},"accessibility":{"status":"Not publicly verified","mobilityEvidence":null,"confidence":"Low"},"trust":{"evidenceGrade":"C","sourceUrls":[],"ownerConfirmed":false,"hoyVerified":false,"liveToday":false},"geo":{"mapUrl":null,"lat":null,"lng":null}},{"id":49,"slug":"49-alma-fit-healthy","name":"ALMA FIT & HEALTHY","entityType":"Provider","locality":"Cabo de Palos","category":"Fitness & wellness","environment":"Indoor / outdoor","status":"Active","suppressed":false,"nowFit":"Medium","priority":"P3","familyData":"Possible / verify","lastVerified":"2026-08-18","contact":{"phone":null,"bookingUrl":null},"commercial":{"priceText":null,"ageRulesText":null},"accessibility":{"status":"Not publicly verified","mobilityEvidence":null,"confidence":"Low"},"trust":{"evidenceGrade":"C","sourceUrls":[],"ownerConfirmed":false,"hoyVerified":false,"liveToday":false},"geo":{"mapUrl":null,"lat":null,"lng":null}},{"id":50,"slug":"50-club-padel-dos-mares-galmaq","name":"Club Padel Dos Mares Galmaq","entityType":"Provider","locality":"La Manga","category":"Racquet sports","environment":"Outdoor / sports","status":"Active","suppressed":false,"nowFit":"High","priority":"P2","familyData":"Possible / verify","lastVerified":"2026-08-18","contact":{"phone":null,"bookingUrl":null},"commercial":{"priceText":null,"ageRulesText":null},"accessibility":{"status":"Not publicly verified","mobilityEvidence":null,"confidence":"Low"},"trust":{"evidenceGrade":"A","sourceUrls":[],"ownerConfirmed":false,"hoyVerified":false,"liveToday":false},"geo":{"mapUrl":null,"lat":null,"lng":null}}]