[{"id":21,"slug":"21-club-de-buceo-atura-sub","name":"Club de Buceo Atura Sub","entityType":"Provider","locality":"Cabo de Palos","category":"Diving & snorkelling","environment":"Outdoor / water","status":"Active / verify","suppressed":false,"nowFit":"Medium","priority":"P3","familyData":"Possible / verify","lastVerified":"2026-08-18","contact":{"phone":null,"bookingUrl":null},"commercial":{"priceText":null,"ageRulesText":null},"accessibility":{"status":"Not publicly verified","mobilityEvidence":null,"confidence":"Low"},"trust":{"evidenceGrade":"C","sourceUrls":[],"ownerConfirmed":false,"hoyVerified":false,"liveToday":false},"geo":{"mapUrl":null,"lat":null,"lng":null}},{"id":22,"slug":"22-caboxperiencia","name":"CaboXperiencia","entityType":"Provider","locality":"Cabo de Palos","category":"Kayak / SUP / adventure","environment":"Outdoor / water","status":"Active","suppressed":false,"nowFit":"High","priority":"P1","familyData":"Yes","lastVerified":"2026-08-18","contact":{"phone":"+34 611 745 978","bookingUrl":"https://caboxperiencia.com/en/kayak-rentals-in-cabo-de-palos/"},"commercial":{"priceText":null,"ageRulesText":null},"accessibility":{"status":"Not publicly verified","mobilityEvidence":null,"confidence":"Low"},"trust":{"evidenceGrade":"A","sourceUrls":["https://caboxperiencia.com/en/kayak-rentals-in-cabo-de-palos/"],"ownerConfirmed":false,"hoyVerified":false,"liveToday":false},"geo":{"mapUrl":null,"lat":null,"lng":null}},{"id":23,"slug":"23-kayak-cabo-de-palos","name":"Kayak Cabo de Palos","entityType":"Provider","locality":"Cabo de Palos","category":"Kayak / SUP / adventure","environment":"Outdoor / water","status":"Active","suppressed":false,"nowFit":"High","priority":"P1","familyData":"Yes","lastVerified":"2026-08-18","contact":{"phone":"+34 647 353 592","bookingUrl":"https://www.kayakcabodepalos.com/"},"commercial":{"priceText":null,"ageRulesText":null},"accessibility":{"status":"Not publicly verified","mobilityEvidence":null,"confidence":"Low"},"trust":{"evidenceGrade":"A","sourceUrls":["https://www.kayakcabodepalos.com/"],"ownerConfirmed":false,"hoyVerified":false,"liveToday":false},"geo":{"mapUrl":null,"lat":null,"lng":null}},{"id":24,"slug":"24-dkayak-kayak-cabo-de-palos","name":"DKAYAK – Kayak Cabo de Palos","entityType":"Provider","locality":"La Manga / Cabo de Palos","category":"Kayak / SUP / adventure","environment":"Outdoor / water","status":"Active","suppressed":false,"nowFit":"High","priority":"P2","familyData":"Yes","lastVerified":"2026-08-18","contact":{"phone":null,"bookingUrl":null},"commercial":{"priceText":null,"ageRulesText":null},"accessibility":{"status":"Not publicly verified","mobilityEvidence":null,"confidence":"Low"},"trust":{"evidenceGrade":"C","sourceUrls":[],"ownerConfirmed":false,"hoyVerified":false,"liveToday":false},"geo":{"mapUrl":null,"lat":null,"lng":null}},{"id":25,"slug":"25-equip-sport-rental-cabo-de-palos","name":"Equip Sport Rental – Cabo de Palos","entityType":"Provider","locality":"Cabo de Palos","category":"SUP / equipment rental","environment":"Outdoor / water","status":"Verify","suppressed":false,"nowFit":"Medium","priority":"P3","familyData":"Yes","lastVerified":"2026-08-18","contact":{"phone":null,"bookingUrl":null},"commercial":{"priceText":null,"ageRulesText":null},"accessibility":{"status":"Not publicly verified","mobilityEvidence":null,"confidence":"Low"},"trust":{"evidenceGrade":"C","sourceUrls":[],"ownerConfirmed":false,"hoyVerified":false,"liveToday":false},"geo":{"mapUrl":null,"lat":null,"lng":null}},{"id":26,"slug":"26-solaz-lines-sea-excursions","name":"SOLAZ LINES – Sea Excursions","entityType":"Provider","locality":"La Manga","category":"Boat excursions","environment":"Outdoor / water","status":"Active","suppressed":false,"nowFit":"High","priority":"P1","familyData":"Yes","lastVerified":"2026-08-18","contact":{"phone":"+34 606 806 795","bookingUrl":"https://www.solazlines.com/index.php/en/routes/from-la-manga"},"commercial":{"priceText":null,"ageRulesText":null},"accessibility":{"status":"Not publicly verified","mobilityEvidence":null,"confidence":"Low"},"trust":{"evidenceGrade":"A","sourceUrls":["https://www.solazlines.com/index.php/en/"],"ownerConfirmed":false,"hoyVerified":false,"liveToday":false},"geo":{"mapUrl":null,"lat":null,"lng":null}},{"id":27,"slug":"27-flippa-boat","name":"Flippa Boat","entityType":"Provider","locality":"La Manga","category":"Boat rental & excursions","environment":"Outdoor / water","status":"Active","suppressed":false,"nowFit":"High","priority":"P1","familyData":"Yes","lastVerified":"2026-08-18","contact":{"phone":"+34 633 163 084","bookingUrl":"https://flippaboat.es/en/book-boat-rental-la-manga-2/"},"commercial":{"priceText":null,"ageRulesText":null},"accessibility":{"status":"Not publicly verified","mobilityEvidence":null,"confidence":"Low"},"trust":{"evidenceGrade":"A","sourceUrls":["https://flippaboat.es/en/boat-rental-services-in-the-sleeve/daily-departures-2/"],"ownerConfirmed":false,"hoyVerified":false,"liveToday":false},"geo":{"mapUrl":null,"lat":null,"lng":null}},{"id":28,"slug":"28-mar-menor-charter","name":"Mar Menor Charter","entityType":"Provider","locality":"Puerto Tomás Maestre","category":"Boat rental & charter","environment":"Outdoor / water","status":"Active","suppressed":false,"nowFit":"High","priority":"P1","familyData":"Yes","lastVerified":"2026-08-18","contact":{"phone":"+34 655 330 301","bookingUrl":"https://www.marmenorcharter.es/home"},"commercial":{"priceText":null,"ageRulesText":null},"accessibility":{"status":"Not publicly verified","mobilityEvidence":null,"confidence":"Low"},"trust":{"evidenceGrade":"A","sourceUrls":["https://www.marmenorcharter.es/home"],"ownerConfirmed":false,"hoyVerified":false,"liveToday":false},"geo":{"mapUrl":null,"lat":null,"lng":null}},{"id":29,"slug":"29-la-manga-mar-menor-charter","name":"La Manga Mar Menor Chárter","entityType":"Provider","locality":"Puerto Tomás Maestre","category":"Boat rental & charter","environment":"Outdoor / water","status":"Active","suppressed":false,"nowFit":"High","priority":"P1","familyData":"Yes","lastVerified":"2026-08-18","contact":{"phone":"+34 675 886 560","bookingUrl":"https://www.lamangamarmenorcharter.com/en/home/"},"commercial":{"priceText":null,"ageRulesText":null},"accessibility":{"status":"Not publicly verified","mobilityEvidence":null,"confidence":"Low"},"trust":{"evidenceGrade":"A","sourceUrls":["https://www.lamangamarmenorcharter.com/en/home/"],"ownerConfirmed":false,"hoyVerified":false,"liveToday":false},"geo":{"mapUrl":null,"lat":null,"lng":null}},{"id":30,"slug":"30-kalima-charter","name":"Kalima Charter","entityType":"Provider","locality":"Puerto Tomás Maestre","category":"Boat rental & charter","environment":"Outdoor / water","status":"Active","suppressed":false,"nowFit":"High","priority":"P1","familyData":"Yes","lastVerified":"2026-08-18","contact":{"phone":"+34 675 567 604","bookingUrl":"https://www.kalimacharter.com/velero-kalima/"},"commercial":{"priceText":null,"ageRulesText":null},"accessibility":{"status":"Not publicly verified","mobilityEvidence":null,"confidence":"Low"},"trust":{"evidenceGrade":"A","sourceUrls":["https://www.kalimacharter.com/velero-kalima/"],"ownerConfirmed":false,"hoyVerified":false,"liveToday":false},"geo":{"mapUrl":null,"lat":null,"lng":null}}]