[{"id":11,"slug":"11-escuela-nautica-el-marino","name":"Escuela Náutica El Marino","entityType":"Provider","locality":"Puerto Tomás Maestre","category":"Nautical school","environment":"Outdoor / water","status":"Active","suppressed":false,"nowFit":"Medium","priority":"P2","familyData":"Possible / verify","lastVerified":"2026-08-18","contact":{"phone":null,"bookingUrl":null},"commercial":{"priceText":null,"ageRulesText":null},"accessibility":{"status":"Not publicly verified","mobilityEvidence":null,"confidence":"Low"},"trust":{"evidenceGrade":"A","sourceUrls":[],"ownerConfirmed":false,"hoyVerified":false,"liveToday":false},"geo":{"mapUrl":null,"lat":null,"lng":null}},{"id":12,"slug":"12-la-manga-surf-school","name":"La Manga Surf School","entityType":"Provider","locality":"La Manga","category":"Surf school","environment":"Outdoor / water","status":"Active","suppressed":false,"nowFit":"High","priority":"P1","familyData":"Yes","lastVerified":"2026-08-18","contact":{"phone":"+34 611 106 711","bookingUrl":"https://lamangasurfschool.es/"},"commercial":{"priceText":null,"ageRulesText":null},"accessibility":{"status":"Not publicly verified","mobilityEvidence":null,"confidence":"Low"},"trust":{"evidenceGrade":"B","sourceUrls":["https://lamangasurfschool.es/"],"ownerConfirmed":false,"hoyVerified":false,"liveToday":false},"geo":{"mapUrl":null,"lat":null,"lng":null}},{"id":13,"slug":"13-club-nautico-dos-mares","name":"Club Náutico Dos Mares","entityType":"Provider/Place","locality":"La Manga","category":"Nautical club","environment":"Outdoor / water","status":"Active","suppressed":false,"nowFit":"Medium","priority":"P2","familyData":"Possible / verify","lastVerified":"2026-08-18","contact":{"phone":null,"bookingUrl":null},"commercial":{"priceText":null,"ageRulesText":null},"accessibility":{"status":"Not publicly verified","mobilityEvidence":null,"confidence":"Medium"},"trust":{"evidenceGrade":"A","sourceUrls":[],"ownerConfirmed":false,"hoyVerified":false,"liveToday":false},"geo":{"mapUrl":null,"lat":null,"lng":null}},{"id":14,"slug":"14-scuba-murcia","name":"Scuba Murcia","entityType":"Provider","locality":"La Manga","category":"Diving & snorkelling","environment":"Outdoor / water","status":"Active","suppressed":false,"nowFit":"High","priority":"P1","familyData":"Possible / verify","lastVerified":"2026-08-18","contact":{"phone":"+34 711 087 476","bookingUrl":"https://www.scubamurcia.com/open-water-diver-spain"},"commercial":{"priceText":null,"ageRulesText":null},"accessibility":{"status":"Not publicly verified","mobilityEvidence":null,"confidence":"Low"},"trust":{"evidenceGrade":"A","sourceUrls":["https://www.scubamurcia.com/open-water-diver-spain"],"ownerConfirmed":false,"hoyVerified":false,"liveToday":false},"geo":{"mapUrl":null,"lat":null,"lng":null}},{"id":15,"slug":"15-divers-cabo-de-palos","name":"Divers Cabo de Palos","entityType":"Provider","locality":"Cabo de Palos","category":"Diving & snorkelling","environment":"Outdoor / water","status":"Active","suppressed":false,"nowFit":"High","priority":"P1","familyData":"Possible / verify","lastVerified":"2026-08-18","contact":{"phone":"+34 687 802 891","bookingUrl":"https://www.diverscabodepalos.com/"},"commercial":{"priceText":null,"ageRulesText":null},"accessibility":{"status":"Not publicly verified","mobilityEvidence":null,"confidence":"Low"},"trust":{"evidenceGrade":"A","sourceUrls":["https://www.diverscabodepalos.com/"],"ownerConfirmed":false,"hoyVerified":false,"liveToday":false},"geo":{"mapUrl":null,"lat":null,"lng":null}},{"id":16,"slug":"16-mangamar-dive-center","name":"Mangamar Dive Center","entityType":"Provider","locality":"Cabo de Palos","category":"Diving & snorkelling","environment":"Outdoor / water","status":"Active","suppressed":false,"nowFit":"High","priority":"P1","familyData":"Possible / verify","lastVerified":"2026-08-18","contact":{"phone":"+34 968 100 860","bookingUrl":"https://mangamardivecenter.com/home-2-dive-center/"},"commercial":{"priceText":null,"ageRulesText":null},"accessibility":{"status":"Adaptive activity available / facility access not fully verified","mobilityEvidence":null,"confidence":"High"},"trust":{"evidenceGrade":"A","sourceUrls":["https://mangamardivecenter.com/home-2-dive-center/"],"ownerConfirmed":false,"hoyVerified":false,"liveToday":false},"geo":{"mapUrl":null,"lat":null,"lng":null}},{"id":17,"slug":"17-diving-center-naranjito","name":"Diving Center Naranjito","entityType":"Provider","locality":"Cabo de Palos","category":"Diving & snorkelling","environment":"Outdoor / water","status":"Active","suppressed":false,"nowFit":"High","priority":"P1","familyData":"Possible / verify","lastVerified":"2026-08-18","contact":{"phone":"+34 696 547 718","bookingUrl":"https://naranjitobuceo.com/"},"commercial":{"priceText":null,"ageRulesText":null},"accessibility":{"status":"Not publicly verified","mobilityEvidence":null,"confidence":"Low"},"trust":{"evidenceGrade":"B","sourceUrls":["https://naranjitobuceo.com/"],"ownerConfirmed":false,"hoyVerified":false,"liveToday":false},"geo":{"mapUrl":null,"lat":null,"lng":null}},{"id":18,"slug":"18-planeta-azul-buceo-y-naturaleza","name":"Planeta Azul Buceo y Naturaleza","entityType":"Provider","locality":"Cabo de Palos","category":"Diving & snorkelling","environment":"Outdoor / water","status":"Active","suppressed":false,"nowFit":"High","priority":"P1","familyData":"Possible / verify","lastVerified":"2026-08-18","contact":{"phone":"+34 968 564 532","bookingUrl":"https://planeta-azul.com/producto/bono-5-inmersiones/"},"commercial":{"priceText":null,"ageRulesText":null},"accessibility":{"status":"Not publicly verified","mobilityEvidence":null,"confidence":"Low"},"trust":{"evidenceGrade":"A","sourceUrls":["https://planeta-azul.com/producto/bono-5-inmersiones/"],"ownerConfirmed":false,"hoyVerified":false,"liveToday":false},"geo":{"mapUrl":null,"lat":null,"lng":null}},{"id":19,"slug":"19-islas-hormigas-diving-club","name":"Islas Hormigas Diving Club","entityType":"Provider","locality":"Cabo de Palos","category":"Diving & snorkelling","environment":"Outdoor / water","status":"Active","suppressed":false,"nowFit":"High","priority":"P1","familyData":"Possible / verify","lastVerified":"2026-08-18","contact":{"phone":"+34 968 145 530","bookingUrl":"https://islashormigas.com/tarifas-buceo-cabo-de-palos/"},"commercial":{"priceText":null,"ageRulesText":null},"accessibility":{"status":"Not publicly verified","mobilityEvidence":null,"confidence":"Low"},"trust":{"evidenceGrade":"A","sourceUrls":["https://islashormigas.com/tarifas-buceo-cabo-de-palos/"],"ownerConfirmed":false,"hoyVerified":false,"liveToday":false},"geo":{"mapUrl":null,"lat":null,"lng":null}},{"id":20,"slug":"20-albadive-diving-experiences","name":"Albadive – Diving & Experiences","entityType":"Provider","locality":"Los Belones","category":"Diving & snorkelling","environment":"Outdoor / water","status":"Active","suppressed":false,"nowFit":"High","priority":"P2","familyData":"Possible / verify","lastVerified":"2026-08-18","contact":{"phone":null,"bookingUrl":null},"commercial":{"priceText":null,"ageRulesText":null},"accessibility":{"status":"Not publicly verified","mobilityEvidence":null,"confidence":"Low"},"trust":{"evidenceGrade":"A","sourceUrls":[],"ownerConfirmed":false,"hoyVerified":false,"liveToday":false},"geo":{"mapUrl":null,"lat":null,"lng":null}}]